{
  "aggregates": {
    "capability_count": 113,
    "counts_by_implementation_state": {
      "excluded": 13,
      "future_owned": 3,
      "implemented_now": 39,
      "reference_only": 39,
      "runtime_implemented": 19
    },
    "selected_count": 61,
    "selected_unmapped_count": 0
  },
  "capabilities": [
    {
      "capability_id": "agents.controller-child-semantics",
      "capability_status": "implemented",
      "claim": "The guarded local controller action is available now; release packaging, iMessage, publication, and conformance remain unclaimed.",
      "implementation_state": "implemented_now",
      "owner": {
        "action": "hatch_repo",
        "kind": "agent",
        "name": "RappStackCubbyController"
      },
      "plane": "agents",
      "selected": true
    },
    {
      "capability_id": "agents.rar-registry",
      "capability_status": "implemented",
      "claim": "Audited reference only; no local implementation is claimed.",
      "implementation_state": "reference_only",
      "owner": {
        "kind": "reference",
        "name": "reference_only"
      },
      "plane": "agents",
      "selected": false
    },
    {
      "capability_id": "agents.sense-overlay",
      "capability_status": "partial",
      "claim": "Audited reference only; no local implementation is claimed.",
      "implementation_state": "reference_only",
      "owner": {
        "kind": "reference",
        "name": "reference_only"
      },
      "plane": "agents",
      "selected": false
    },
    {
      "capability_id": "agents.single-file-cartridge",
      "capability_status": "implemented",
      "claim": "The focused agent action is available now; this is not an artifact, deployment, lifecycle, or conformance claim.",
      "implementation_state": "implemented_now",
      "owner": {
        "action": "render",
        "kind": "agent",
        "name": "AgentFactory"
      },
      "plane": "agents",
      "selected": true
    },
    {
      "capability_id": "agents.skill-not-agent",
      "capability_status": "contradictory",
      "claim": "The focused agent action is available now; this is not an artifact, deployment, lifecycle, or conformance claim.",
      "implementation_state": "implemented_now",
      "owner": {
        "action": "inspect",
        "kind": "agent",
        "name": "Registry"
      },
      "plane": "agents",
      "selected": true
    },
    {
      "capability_id": "agents.stack-loader",
      "capability_status": "partial",
      "claim": "Audited reference only; no local implementation is claimed.",
      "implementation_state": "reference_only",
      "owner": {
        "kind": "reference",
        "name": "reference_only"
      },
      "plane": "agents",
      "selected": false
    },
    {
      "capability_id": "chat.complete-twin-envelope",
      "capability_status": "partial",
      "claim": "The local runtime component exists but remains unattested.",
      "implementation_state": "runtime_implemented",
      "owner": {
        "action": "twin-chat",
        "kind": "runtime",
        "name": "signed-ingress"
      },
      "plane": "chat/network",
      "selected": true
    },
    {
      "capability_id": "chat.local-post-chat",
      "capability_status": "implemented",
      "claim": "The local runtime component exists but remains unattested.",
      "implementation_state": "runtime_implemented",
      "owner": {
        "action": "chat",
        "kind": "runtime",
        "name": "isolated-runtime"
      },
      "plane": "chat/network",
      "selected": true
    },
    {
      "capability_id": "chat.project-twin-network",
      "capability_status": "partial",
      "claim": "Audited reference only; no local implementation is claimed.",
      "implementation_state": "reference_only",
      "owner": {
        "kind": "reference",
        "name": "reference_only"
      },
      "plane": "chat/network",
      "selected": false
    },
    {
      "capability_id": "chat.replay-idempotency",
      "capability_status": "spec_only",
      "claim": "The local runtime component exists but remains unattested.",
      "implementation_state": "runtime_implemented",
      "owner": {
        "action": "replay-journal",
        "kind": "runtime",
        "name": "signed-ingress"
      },
      "plane": "chat/network",
      "selected": true
    },
    {
      "capability_id": "chat.signed-commons-wrapper",
      "capability_status": "contradictory",
      "claim": "The guarded local controller action is available now; release packaging, iMessage, publication, and conformance remain unclaimed.",
      "implementation_state": "implemented_now",
      "owner": {
        "action": "chat",
        "kind": "agent",
        "name": "RappStackCubbyController"
      },
      "plane": "chat/network",
      "selected": true
    },
    {
      "capability_id": "chat.signed-response",
      "capability_status": "partial",
      "claim": "The local runtime component exists but remains unattested.",
      "implementation_state": "runtime_implemented",
      "owner": {
        "action": "signed-response",
        "kind": "runtime",
        "name": "signed-ingress"
      },
      "plane": "chat/network",
      "selected": true
    },
    {
      "capability_id": "cloud.azure-functions-body",
      "capability_status": "implemented",
      "claim": "Audited reference only; no local implementation is claimed.",
      "implementation_state": "reference_only",
      "owner": {
        "kind": "reference",
        "name": "reference_only"
      },
      "plane": "cloud/enterprise",
      "selected": false
    },
    {
      "capability_id": "cloud.communityrapp-progression",
      "capability_status": "partial",
      "claim": "Audited reference only; no local implementation is claimed.",
      "implementation_state": "reference_only",
      "owner": {
        "kind": "reference",
        "name": "reference_only"
      },
      "plane": "cloud/enterprise",
      "selected": false
    },
    {
      "capability_id": "cloud.copilot-studio-package",
      "capability_status": "partial",
      "claim": "Audited reference only; no local implementation is claimed.",
      "implementation_state": "reference_only",
      "owner": {
        "kind": "reference",
        "name": "reference_only"
      },
      "plane": "cloud/enterprise",
      "selected": false
    },
    {
      "capability_id": "cloud.dataverse-twin",
      "capability_status": "partial",
      "claim": "Audited reference only; no local implementation is claimed.",
      "implementation_state": "reference_only",
      "owner": {
        "kind": "reference",
        "name": "reference_only"
      },
      "plane": "cloud/enterprise",
      "selected": false
    },
    {
      "capability_id": "cloud.m365-agent-surfaces",
      "capability_status": "partial",
      "claim": "Audited reference only; no local implementation is claimed.",
      "implementation_state": "reference_only",
      "owner": {
        "kind": "reference",
        "name": "reference_only"
      },
      "plane": "cloud/enterprise",
      "selected": false
    },
    {
      "capability_id": "cloud.oneclick-import",
      "capability_status": "implemented",
      "claim": "Audited reference only; no local implementation is claimed.",
      "implementation_state": "reference_only",
      "owner": {
        "kind": "reference",
        "name": "reference_only"
      },
      "plane": "cloud/enterprise",
      "selected": false
    },
    {
      "capability_id": "distribution.brainstem-cubby-egg",
      "capability_status": "contradictory",
      "claim": "The deterministic local packaging or hatch component is tested; public release and final-commit attestation remain unclaimed.",
      "implementation_state": "implemented_now",
      "owner": {
        "kind": "packaging",
        "name": "artifact-build"
      },
      "plane": "distribution",
      "selected": true
    },
    {
      "capability_id": "distribution.cart-experience",
      "capability_status": "spec_only",
      "claim": "Audited reference only; no local implementation is claimed.",
      "implementation_state": "reference_only",
      "owner": {
        "kind": "reference",
        "name": "reference_only"
      },
      "plane": "distribution",
      "selected": false
    },
    {
      "capability_id": "distribution.cubby",
      "capability_status": "contradictory",
      "claim": "The focused agent action is available now; this is not an artifact, deployment, lifecycle, or conformance claim.",
      "implementation_state": "implemented_now",
      "owner": {
        "action": "render",
        "kind": "agent",
        "name": "Cubby"
      },
      "plane": "distribution",
      "selected": true
    },
    {
      "capability_id": "distribution.deprecated-installer-lines",
      "capability_status": "deprecated",
      "claim": "Excluded from the selected local profile.",
      "implementation_state": "excluded",
      "owner": {
        "kind": "excluded",
        "name": "excluded"
      },
      "plane": "distribution",
      "selected": false
    },
    {
      "capability_id": "distribution.deterministic-build",
      "capability_status": "partial",
      "claim": "The deterministic local packaging or hatch component is tested; public release and final-commit attestation remain unclaimed.",
      "implementation_state": "implemented_now",
      "owner": {
        "kind": "packaging",
        "name": "artifact-build"
      },
      "plane": "distribution",
      "selected": true
    },
    {
      "capability_id": "distribution.distro",
      "capability_status": "contradictory",
      "claim": "Audited reference only; no local implementation is claimed.",
      "implementation_state": "reference_only",
      "owner": {
        "kind": "reference",
        "name": "reference_only"
      },
      "plane": "distribution",
      "selected": false
    },
    {